{
  "backend": "anthropic",
  "model": "claude-fixture-1",
  "output": {
    "ranked": [
      {
        "title": "Book the train tickets",
        "why": "today"
      },
      {
        "title": "Read the onboarding guide",
        "why": "later"
      }
    ],
    "summary": "One task is due today."
  },
  "request": {
    "input_sha256": "218d9cb5f61bb066b7b7e7c8b34cbabea3ca53edb5cca94693a22a4cf6336f7c",
    "schema_sha256": "ac6fa6aea53bf3c9796e4e34c62460b13ecb70a8784d25670f377e0bde52062d",
    "system_sha256": "db338864354ac638905a84278b63ff160ae4c98707055d7136777e4a543598c2"
  },
  "schema_version": 1,
  "skill": "daily-brief/rank-and-word",
  "skill_digest": "b2b672ce0c2e1a340d0028e143ca634593bdd460d0a700033be254977b569806",
  "skill_version": "1.0.0",
  "stop_reason": "end_turn",
  "usage": {
    "cache_read_tokens": null,
    "cache_write_tokens": null,
    "priced": false,
    "tokens_in": 540,
    "tokens_out": 41,
    "usd": 0.0
  }
}
